{
  "$schema": "http://json-schema.org/draft-04/schema#",
  "description": "File definition",
  "type": "object",
  "additionalProperties": false,
  "properties": {
    "id": {
      "description": "UUID of this File Definition",
      "type": "string",
      "format": "uuid"
    },
    "fileName": {
      "description": "File name",
      "type": "string"
    },
    "jobExecutionId": {
      "description": "Job execution id",
      "type": "string",
      "format": "uuid"
    },
    "sourcePath": {
      "description": "Path to the file",
      "type": "string"
    },
    "status": {
      "description": "Status of file upload",
      "type": "string",
      "enum": [
        "NEW",
        "IN_PROGRESS",
        "COMPLETED",
        "ERROR"
      ]
    },
    "size": {
      "description": "Size of the file in Kbyte",
      "type": "integer"
    },
    "uploadFormat": {
      "description": "Format of upload file",
      "type": "string",
      "enum": [
        "csv",
        "cql"
      ],
      "default": "csv"
    },
    "metadata": {
      "description": "Meta information ",
      "type": "object",
      "$ref": "metadata.json"
    }
  },
  "required": [
    "fileName"
  ]
}
