{
   "id":"88dfac11-1caf-4470-9ad1-d533f6360bdd",
   "fileName":"marc.csv",
   "status":"COMPLETED",
   "size" : 200,
   "uploadFormat": "csv",
   "metadata":
    {
     "createdDate": "2019-07-22T11:22:07Z",
     "createdByUserId": "dee12548-9cee-45fa-bbae-675c1cc0ce3b",
     "createdByUsername": "janedoeuser",
     "updatedDate": "2019-07-27T13:28:54Z",
     "updatedByUserId": "dee12548-9cee-45fa-bbae-675c1cc0ce3b",
     "updatedByUsername": ""
   }
}
